{"commodities":[{"capacity_units_per_ton":1.0,"handling_usd_ton":9.0,"id":"ambient","label":"Packaged goods","rate_in_usd_ton_mi":0.12,"rate_out_usd_ton_mi":0.35,"tons_per_1000_pop":14.0},{"capacity_units_per_ton":1.6,"handling_usd_ton":22.0,"id":"cold","label":"Cold chain","rate_in_usd_ton_mi":0.2,"rate_out_usd_ton_mi":0.6,"tons_per_1000_pop":4.0},{"capacity_units_per_ton":0.8,"handling_usd_ton":14.0,"id":"bulk","label":"Bulky goods","rate_in_usd_ton_mi":0.09,"rate_out_usd_ton_mi":0.25,"tons_per_1000_pop":22.0}],"constants":{"capacity_headroom":2.4,"circuity":1.2,"earth_radius_mi":3958.8,"fixed_base_usd_yr":20000000.0,"nearest_sites_per_demand_node":5,"noise_sd":0.12,"plant_pool":30,"plant_shares":[0.4,0.35,0.25],"seed":20261011,"site_pool":60,"supply_headroom":1.25},"demand_nodes":[{"demand_tons":[124796,29091,195028],"geoid":"3651000","id":"D000","lat":40.662712,"lon":-73.938677,"name":"New York city","pop2025":8584629,"state":"NY"},{"demand_tons":[48588,16690,75677],"geoid":"0644000","id":"D001","lat":34.019394,"lon":-118.410825,"name":"Los Angeles city","pop2025":3869089,"state":"CA"},{"demand_tons":[33766,8785,77163],"geoid":"1714000","id":"D002","lat":41.837045,"lon":-87.684939,"name":"Chicago city","pop2025":2731585,"state":"IL"},{"demand_tons":[36185,11189,54421],"geoid":"4835000","id":"D003","lat":29.785743,"lon":-95.388806,"name":"Houston city","pop2025":2397315,"state":"TX"},{"demand_tons":[23356,6147,37233],"geoid":"0455000","id":"D004","lat":33.572154,"lon":-112.090132,"name":"Phoenix city","pop2025":1665481,"state":"AZ"},{"demand_tons":[24896,5132,27422],"geoid":"4260000","id":"D005","lat":40.009297,"lon":-75.133271,"name":"Philadelphia city","pop2025":1574281,"state":"PA"},{"demand_tons":[19857,6689,39984],"geoid":"4865000","id":"D006","lat":29.459775,"lon":-98.524263,"name":"San Antonio city","pop2025":1548422,"state":"TX"},{"demand_tons":[18999,6043,27873],"geoid":"0666000","id":"D007","lat":32.830391,"lon":-117.120923,"name":"San Diego city","pop2025":1406106,"state":"CA"},{"demand_tons":[19230,5450,35310],"geoid":"4819000","id":"D008","lat":32.793333,"lon":-96.766513,"name":"Dallas city","pop2025":1329491,"state":"TX"},{"demand_tons":[15176,4064,22888],"geoid":"4827000","id":"D009","lat":32.781954,"lon":-97.348573,"name":"Fort Worth city","pop2025":1028117,"state":"TX"},{"demand_tons":[14655,4429,24781],"geoid":"1235000","id":"D010","lat":30.335914,"lon":-81.661762,"name":"Jacksonville city","pop2025":1017689,"state":"FL"},{"demand_tons":[14099,3387,24594],"geoid":"4805000","id":"D011","lat":30.298622,"lon":-97.754134,"name":"Austin city","pop2025":1002632,"state":"TX"},{"demand_tons":[13191,4051,24703],"geoid":"0668000","id":"D012","lat":37.296011,"lon":-121.814552,"name":"San Jose city","pop2025":989814,"state":"CA"},{"demand_tons":[15612,3379,21946],"geoid":"3712000","id":"D013","lat":35.209045,"lon":-80.83099,"name":"Charlotte city","pop2025":964784,"state":"NC"},{"demand_tons":[16285,4215,18283],"geoid":"3918000","id":"D014","lat":39.987367,"lon":-82.98518,"name":"Columbus city","pop2025":938396,"state":"OH"},{"demand_tons":[10363,3180,17164],"geoid":"0667000","id":"D015","lat":37.727239,"lon":-123.032229,"name":"San Francisco city","pop2025":826079,"state":"CA"},{"demand_tons":[10172,2970,17725],"geoid":"5363000","id":"D016","lat":47.619335,"lon":-122.351538,"name":"Seattle city","pop2025":784777,"state":"WA"},{"demand_tons":[9958,2756,14688],"geoid":"0820000","id":"D017","lat":39.76185,"lon":-104.881105,"name":"Denver city","pop2025":740613,"state":"CO"},{"demand_tons":[10834,3363,15959],"geoid":"4055000","id":"D018","lat":35.467079,"lon":-97.513657,"name":"Oklahoma City city","pop2025":719849,"state":"OK"},{"demand_tons":[11218,3044,16200],"geoid":"4824000","id":"D019","lat":31.84778,"lon":-106.431106,"name":"El Paso city","pop2025":683012,"state":"TX"},{"demand_tons":[10072,2393,14388],"geoid":"3240000","id":"D020","lat":36.233499,"lon":-115.264037,"name":"Las Vegas city","pop2025":679817,"state":"NV"},{"demand_tons":[9302,2439,15222],"geoid":"2507000","id":"D021","lat":42.332735,"lon":-71.013513,"name":"Boston city","pop2025":672973,"state":"MA"},{"demand_tons":[8994,2701,14768],"geoid":"2622000","id":"D022","lat":42.383037,"lon":-83.102237,"name":"Detroit city","pop2025":649095,"state":"MI"},{"demand_tons":[11134,2602,12656],"geoid":"4159000","id":"D023","lat":45.536951,"lon":-122.649971,"name":"Portland city","pop2025":635109,"state":"OR"},{"demand_tons":[9877,2149,15381],"geoid":"4748000","id":"D024","lat":35.109164,"lon":-89.968511,"name":"Memphis city","pop2025":609647,"state":"TN"},{"demand_tons":[7371,2278,13615],"geoid":"2404000","id":"D025","lat":39.300061,"lon":-76.610518,"name":"Baltimore city","pop2025":569997,"state":"MD"},{"demand_tons":[7144,2091,13517],"geoid":"5553000","id":"D026","lat":43.063348,"lon":-87.966695,"name":"Milwaukee city","pop2025":562407,"state":"WI"},{"demand_tons":[7746,2486,13495],"geoid":"3502000","id":"D027","lat":35.10478,"lon":-106.646809,"name":"Albuquerque city","pop2025":556588,"state":"NM"},{"demand_tons":[7396,2156,14156],"geoid":"0627000","id":"D028","lat":36.782697,"lon":-119.796184,"name":"Fresno city","pop2025":555549,"state":"CA"},{"demand_tons":[7405,2552,12054],"geoid":"0477000","id":"D029","lat":32.152831,"lon":-110.87075,"name":"Tucson city","pop2025":548371,"state":"AZ"},{"demand_tons":[8582,1985,13560],"geoid":"0664000","id":"D030","lat":38.567694,"lon":-121.468161,"name":"Sacramento city","pop2025":536449,"state":"CA"},{"demand_tons":[9232,2119,9981],"geoid":"1304000","id":"D031","lat":33.762909,"lon":-84.422675,"name":"Atlanta city","pop2025":529110,"state":"GA"},{"demand_tons":[6018,2287,9974],"geoid":"2938000","id":"D032","lat":39.125155,"lon":-94.550313,"name":"Kansas City city","pop2025":521220,"state":"MO"},{"demand_tons":[6021,1945,10974],"geoid":"0446000","id":"D033","lat":33.399355,"lon":-111.715968,"name":"Mesa city","pop2025":513656,"state":"AZ"},{"demand_tons":[8085,2017,10603],"geoid":"3755000","id":"D034","lat":35.831456,"lon":-78.639558,"name":"Raleigh city","pop2025":506306,"state":"NC"},{"demand_tons":[6561,2137,8710],"geoid":"0816000","id":"D035","lat":38.867255,"lon":-104.760749,"name":"Colorado Springs city","pop2025":494743,"state":"CO"},{"demand_tons":[7381,2233,10974],"geoid":"1245000","id":"D036","lat":25.775163,"lon":-80.208615,"name":"Miami city","pop2025":489812,"state":"FL"},{"demand_tons":[7633,2003,7499],"geoid":"3137000","id":"D037","lat":41.264013,"lon":-96.056496,"name":"Omaha city","pop2025":488797,"state":"NE"},{"demand_tons":[7457,2208,9040],"geoid":"5182000","id":"D038","lat":36.779113,"lon":-76.02845,"name":"Virginia Beach city","pop2025":453737,"state":"VA"},{"demand_tons":[6419,2466,10326],"geoid":"0643000","id":"D039","lat":33.780791,"lon":-118.16818,"name":"Long Beach city","pop2025":450469,"state":"CA"},{"demand_tons":[6940,1823,9255],"geoid":"0653000","id":"D040","lat":37.769936,"lon":-122.225686,"name":"Oakland city","pop2025":440838,"state":"CA"},{"demand_tons":[6741,1718,9576],"geoid":"2743000","id":"D041","lat":44.963324,"lon":-93.26832,"name":"Minneapolis city","pop2025":430324,"state":"MN"},{"demand_tons":[5689,1537,9525],"geoid":"0603526","id":"D042","lat":35.353174,"lon":-119.037878,"name":"Bakersfield city","pop2025":422165,"state":"CA"},{"demand_tons":[5715,1842,7928],"geoid":"4075000","id":"D043","lat":36.127949,"lon":-95.902316,"name":"Tulsa city","pop2025":416209,"state":"OK"},{"demand_tons":[6060,1540,9813],"geoid":"1271000","id":"D044","lat":27.967876,"lon":-82.474586,"name":"Tampa city","pop2025":413554,"state":"FL"},{"demand_tons":[6332,1543,9610],"geoid":"0804000","id":"D045","lat":39.688296,"lon":-104.6894,"name":"Aurora city","pop2025":410053,"state":"CO"},{"demand_tons":[5036,1487,7402],"geoid":"4804000","id":"D046","lat":32.700708,"lon":-97.124691,"name":"Arlington city","pop2025":402134,"state":"TX"},{"demand_tons":[5561,1703,8927],"geoid":"2079000","id":"D047","lat":37.689344,"lon":-97.348353,"name":"Wichita city","pop2025":400987,"state":"KS"},{"demand_tons":[5450,1411,8044],"geoid":"3916000","id":"D048","lat":41.478462,"lon":-81.679435,"name":"Cleveland city","pop2025":363608,"state":"OH"},{"demand_tons":[4366,1523,8023],"geoid":"2255000","id":"D049","lat":30.052877,"lon":-89.934502,"name":"New Orleans city","pop2025":362154,"state":"LA"},{"demand_tons":[5400,1563,8752],"geoid":"3231900","id":"D050","lat":36.0056,"lon":-115.022812,"name":"Henderson city","pop2025":353289,"state":"NV"},{"demand_tons":[4602,1354,7364],"geoid":"0602000","id":"D051","lat":33.855502,"lon":-117.758657,"name":"Anaheim city","pop2025":341008,"state":"CA"},{"demand_tons":[4676,1294,7923],"geoid":"1253000","id":"D052","lat":28.472265,"lon":-81.322452,"name":"Orlando city","pop2025":333888,"state":"FL"},{"demand_tons":[5808,1080,8271],"geoid":"2146027","id":"D053","lat":38.040638,"lon":-84.458238,"name":"Lexington-Fayette urban county","pop2025":329751,"state":"KY"},{"demand_tons":[4220,1364,6631],"geoid":"0675000","id":"D054","lat":37.976553,"lon":-121.308598,"name":"Stockton city","pop2025":324597,"state":"CA"},{"demand_tons":[4943,1209,6937],"geoid":"3451000","id":"D055","lat":40.72422,"lon":-74.172574,"name":"Newark city","pop2025":323808,"state":"NJ"},{"demand_tons":[4563,1516,7612],"geoid":"0662000","id":"D056","lat":33.938143,"lon":-117.393168,"name":"Riverside city","pop2025":323057,"state":"CA"},{"demand_tons":[4178,1312,7557],"geoid":"0636770","id":"D057","lat":33.678399,"lon":-117.771254,"name":"Irvine city","pop2025":318764,"state":"CA"},{"demand_tons":[3906,1264,6424],"geoid":"4817000","id":"D058","lat":27.754252,"lon":-97.173385,"name":"Corpus Christi city","pop2025":317247,"state":"TX"},{"demand_tons":[4011,1273,5832],"geoid":"0669000","id":"D059","lat":33.736787,"lon":-117.882906,"name":"Santa Ana city","pop2025":315586,"state":"CA"},{"demand_tons":[5302,1120,7810],"geoid":"3915000","id":"D060","lat":39.140183,"lon":-84.505829,"name":"Cincinnati city","pop2025":31436